title,description,author_name,timestamp,url,guid,tags,domains,mpeg_file,title_image,abstract,torrent,producer,disseminator,copyright,duration,channel
"World Championship Snooker Highlights 2011, Day 2","Highlights of day two at the Crucible, where 12 players were in action.",BBC,1303131413,http://p2pnextfeed1-staging.rad0.net/v2/content/info/bbc/bbctwo/b010pznk,urn:bbc-bbctwo-b010pznk,,,http://p2pnextfeed1-staging.rad0.net/v2/content/info/bbc/bbctwo/b010pznk,http://www.bbc.co.uk/iplayer/images/series/b010q8qd_150_84.jpg,"Highlights of day two at the Crucible, where 12 players were in action.",,BBC,BBC,"Copyright 2011 BBC",PT0H50M0S,"BBC Two England"
"World Championship Snooker Extra 2011, Day 2","Extended highlights of the day's first round matches in Sheffield.",BBC,1303131413,http://p2pnextfeed1-staging.rad0.net/v2/content/info/bbc/bbctwo/b010pznm,urn:bbc-bbctwo-b010pznm,,,http://p2pnextfeed1-staging.rad0.net/v2/content/info/bbc/bbctwo/b010pznm,http://www.bbc.co.uk/iplayer/images/series/b010q8qq_150_84.jpg,"Extended highlights of the day's first round matches in Sheffield.",,BBC,BBC,"Copyright 2011 BBC",PT2H0M0S,"BBC Two England"
"Joins BBC News","BBC Two joins the BBC's rolling news channel.",BBC,1303131413,http://p2pnextfeed1-staging.rad0.net/v2/content/info/bbc/bbctwo/b010d2ll,urn:bbc-bbctwo-b010d2ll,,,http://p2pnextfeed1-staging.rad0.net/v2/content/info/bbc/bbctwo/b010d2ll,http://www.bbc.co.uk/iplayer/images/progbrand/b00h9fxh_150_84.jpg,"BBC Two joins the BBC's rolling news channel.",,BBC,BBC,"Copyright 2011 BBC",PT0H35M0S,"BBC Two England"
"Finley the Fire Engine It's No Game","Miguel becomes obsessed with Scooty's video game and starts neglecting his friends.",BBC,1303131413,http://p2pnextfeed1-staging.rad0.net/v2/content/info/bbc/bbctwo/b008znfm,urn:bbc-bbctwo-b008znfm,,,http://p2pnextfeed1-staging.rad0.net/v2/content/info/bbc/bbctwo/b008znfm,http://www.bbc.co.uk/iplayer/images/progbrand/b007vhwd_150_84.jpg,"Miguel becomes obsessed with Scooty's video game and starts neglecting his friends.",,BBC,BBC,"Copyright 2011 BBC",PT0H10M0S,"BBC Two England"
"Zigby Zigby's Restaurant","Zigby opens a new restaurant, but where is the food and why is the chef asleep?",BBC,1303131413,http://p2pnextfeed1-staging.rad0.net/v2/content/info/bbc/bbctwo/b00r4xfn,urn:bbc-bbctwo-b00r4xfn,,,http://p2pnextfeed1-staging.rad0.net/v2/content/info/bbc/bbctwo/b00r4xfn,http://www.bbc.co.uk/iplayer/images/series/b00nkcbn_150_84.jpg,"Zigby opens a new restaurant, but where is the food and why is the chef asleep?",,BBC,BBC,"Copyright 2011 BBC",PT0H10M0S,"BBC Two England"
"The Large Family Series 1, Mr Short Takes a Holiday","The Large family discover that Mr Short, the shopkeeper, has never had a holiday.",BBC,1303131413,http://p2pnextfeed1-staging.rad0.net/v2/content/info/bbc/bbctwo/b008zhvp,urn:bbc-bbctwo-b008zhvp,,,http://p2pnextfeed1-staging.rad0.net/v2/content/info/bbc/bbctwo/b008zhvp,http://www.bbc.co.uk/iplayer/images/series/b00qclq1_150_84.jpg,"The Large family discover that Mr Short, the shopkeeper, has never had a holiday.",,BBC,BBC,"Copyright 2011 BBC",PT0H15M0S,"BBC Two England"
"Little Robots Series 1, Robot Race Day","Sporty is determined to show off his sporting prowess to the other Little Robots.",BBC,1303131413,http://p2pnextfeed1-staging.rad0.net/v2/content/info/bbc/bbctwo/b0078hg0,urn:bbc-bbctwo-b0078hg0,,,http://p2pnextfeed1-staging.rad0.net/v2/content/info/bbc/bbctwo/b0078hg0,http://www.bbc.co.uk/iplayer/images/series/b007yznd_150_84.jpg,"Sporty is determined to show off his sporting prowess to the other Little Robots.",,BBC,BBC,"Copyright 2011 BBC",PT0H10M0S,"BBC Two England"
"Charlie and Lola Series 1, I Must Take Completely Everything","Lola goes to Lotta's for the night, so Charlie and Marv have the room to themselves.",BBC,1303131413,http://p2pnextfeed1-staging.rad0.net/v2/content/info/bbc/bbctwo/b0078zvr,urn:bbc-bbctwo-b0078zvr,,,http://p2pnextfeed1-staging.rad0.net/v2/content/info/bbc/bbctwo/b0078zvr,http://www.bbc.co.uk/iplayer/images/series/b0073hbv_150_84.jpg,"Lola goes to Lotta's for the night, so Charlie and Marv have the room to themselves.",,BBC,BBC,"Copyright 2011 BBC",PT0H15M0S,"BBC Two England"
"Little Howard's Big Question Series 1, What is the World's Most Dangerous Food?","A sudden fear of coconuts sends Little Howard off on a quest.",BBC,1303131413,http://p2pnextfeed1-staging.rad0.net/v2/content/info/bbc/bbctwo/b00j8ghz,urn:bbc-bbctwo-b00j8ghz,,,http://p2pnextfeed1-staging.rad0.net/v2/content/info/bbc/bbctwo/b00j8ghz,http://www.bbc.co.uk/iplayer/images/series/b00gwcxp_150_84.jpg,"A sudden fear of coconuts sends Little Howard off on a quest.",,BBC,BBC,"Copyright 2011 BBC",PT0H25M0S,"BBC Two England"
Newsround,"Daily news magazine keeping young viewers up to date on the latest stories.",BBC,1303131413,http://p2pnextfeed1-staging.rad0.net/v2/content/info/bbc/bbctwo/b010qbpp,urn:bbc-bbctwo-b010qbpp,,,http://p2pnextfeed1-staging.rad0.net/v2/content/info/bbc/bbctwo/b010qbpp,http://www.bbc.co.uk/iplayer/images/progbrand/b006mdbc_150_84.jpg,"Daily news magazine keeping young viewers up to date on the latest stories.",,BBC,BBC,"Copyright 2011 BBC",PT0H5M0S,"BBC Two England"
"What's New Scooby Doo? Series 3, Gold Paw","The gang's visit to Fort Knox uncovers a priceless monster.",BBC,1303131413,http://p2pnextfeed1-staging.rad0.net/v2/content/info/bbc/bbctwo/b0079113,urn:bbc-bbctwo-b0079113,,,http://p2pnextfeed1-staging.rad0.net/v2/content/info/bbc/bbctwo/b0079113,http://www.bbc.co.uk/iplayer/images/series/b007r51d_150_84.jpg,"The gang's visit to Fort Knox uncovers a priceless monster.",,BBC,BBC,"Copyright 2011 BBC",PT0H20M0S,"BBC Two England"
"League of Super Evil Series 2, Hard Boiled","The Great Voltar sets his sights on destroying breakfast but his plan backfires.",BBC,1303131413,http://p2pnextfeed1-staging.rad0.net/v2/content/info/bbc/bbctwo/b00vjg15,urn:bbc-bbctwo-b00vjg15,,,http://p2pnextfeed1-staging.rad0.net/v2/content/info/bbc/bbctwo/b00vjg15,http://www.bbc.co.uk/iplayer/images/series/b00vjks1_150_84.jpg,"The Great Voltar sets his sights on destroying breakfast but his plan backfires.",,BBC,BBC,"Copyright 2011 BBC",PT0H10M0S,"BBC Two England"
"Copycats Series 2, Episode 32","Two families battle it out in hilarious games including Mime Time and Music Round.",BBC,1303131413,http://p2pnextfeed1-staging.rad0.net/v2/content/info/bbc/bbctwo/b00zgqhc,urn:bbc-bbctwo-b00zgqhc,,,http://p2pnextfeed1-staging.rad0.net/v2/content/info/bbc/bbctwo/b00zgqhc,http://www.bbc.co.uk/iplayer/images/series/b00w07hj_150_84.jpg,"Two families battle it out in hilarious games including Mime Time and Music Round.",,BBC,BBC,"Copyright 2011 BBC",PT0H30M0S,"BBC Two England"
"LazyTown Series 1, Friends Forever","Stephanie creates a playpark for her friends, but they are lured away by Robbie's sweets.",BBC,1303131413,http://p2pnextfeed1-staging.rad0.net/v2/content/info/bbc/bbctwo/b0079ff2,urn:bbc-bbctwo-b0079ff2,,,http://p2pnextfeed1-staging.rad0.net/v2/content/info/bbc/bbctwo/b0079ff2,http://www.bbc.co.uk/iplayer/images/series/b006v85v_150_84.jpg,"Stephanie creates a playpark for her friends, but they are lured away by Robbie's sweets.",,BBC,BBC,"Copyright 2011 BBC",PT0H25M0S,"BBC Two England"
"Bob the Builder: Project Build It Series 3, Sumsy and the Beast","It is early morning and there's a strange creature in Sunflower Valley.",BBC,1303131413,http://p2pnextfeed1-staging.rad0.net/v2/content/info/bbc/bbctwo/b00794ty,urn:bbc-bbctwo-b00794ty,,,http://p2pnextfeed1-staging.rad0.net/v2/content/info/bbc/bbctwo/b00794ty,http://www.bbc.co.uk/iplayer/images/series/b007xckr_150_84.jpg,"It is early morning and there's a strange creature in Sunflower Valley.",,BBC,BBC,"Copyright 2011 BBC",PT0H10M0S,"BBC Two England"
"The Koala Brothers Series 3, Sammy and the Bee","Sammy loses one of his bees and Mitzi is puzzled, as she thinks all bees are the same.",BBC,1303131413,http://p2pnextfeed1-staging.rad0.net/v2/content/info/bbc/bbctwo/b0079dly,urn:bbc-bbctwo-b0079dly,,,http://p2pnextfeed1-staging.rad0.net/v2/content/info/bbc/bbctwo/b0079dly,http://www.bbc.co.uk/iplayer/images/series/b007glq3_150_84.jpg,"Sammy loses one of his bees and Mitzi is puzzled, as she thinks all bees are the same.",,BBC,BBC,"Copyright 2011 BBC",PT0H15M0S,"BBC Two England"
"Guess with Jess How Can We Keep Dry for Horace's Concert?","Horace puts on a music show, but when it rains Jess must find a way to keep everyone dry.",BBC,1303131413,http://p2pnextfeed1-staging.rad0.net/v2/content/info/bbc/bbctwo/b00r91h2,urn:bbc-bbctwo-b00r91h2,,,http://p2pnextfeed1-staging.rad0.net/v2/content/info/bbc/bbctwo/b00r91h2,http://www.bbc.co.uk/iplayer/images/series/b00nyg2r_150_84.jpg,"Horace puts on a music show, but when it rains Jess must find a way to keep everyone dry.",,BBC,BBC,"Copyright 2011 BBC",PT0H10M0S,"BBC Two England"
"Big and Small Series 1, Surprise Surprise","Small is determined to find out the fun surprise that Big is planning for him.",BBC,1303131413,http://p2pnextfeed1-staging.rad0.net/v2/content/info/bbc/bbctwo/b00f6n3d,urn:bbc-bbctwo-b00f6n3d,,,http://p2pnextfeed1-staging.rad0.net/v2/content/info/bbc/bbctwo/b00f6n3d,http://www.bbc.co.uk/iplayer/images/series/b00dzm5r_150_84.jpg,"Small is determined to find out the fun surprise that Big is planning for him.",,BBC,BBC,"Copyright 2011 BBC",PT0H15M0S,"BBC Two England"
"Chuggington: Badge Quest Rainbow Chuggers","The Chuggers need to solve a number of clues to find six colored cars in hidden locations.",BBC,1303131413,http://p2pnextfeed1-staging.rad0.net/v2/content/info/bbc/bbctwo/b00tbskv,urn:bbc-bbctwo-b00tbskv,,,http://p2pnextfeed1-staging.rad0.net/v2/content/info/bbc/bbctwo/b00tbskv,http://www.bbc.co.uk/iplayer/images/series/b00t9k4p_150_84.jpg,"The Chuggers need to solve a number of clues to find six colored cars in hidden locations.",,BBC,BBC,"Copyright 2011 BBC",PT0H5M0S,"BBC Two England"
"Grandpa In My Pocket Series 2, A Very Needy Speedy Edie","Speedy Edie's shopping style sends Mr Liker Biker into a spin.",BBC,1303131413,http://p2pnextfeed1-staging.rad0.net/v2/content/info/bbc/bbctwo/b00r93yd,urn:bbc-bbctwo-b00r93yd,,,http://p2pnextfeed1-staging.rad0.net/v2/content/info/bbc/bbctwo/b00r93yd,http://www.bbc.co.uk/iplayer/images/series/b00r0tcf_150_84.jpg,"Speedy Edie's shopping style sends Mr Liker Biker into a spin.",,BBC,BBC,"Copyright 2011 BBC",PT0H15M0S,"BBC Two England"
"Mighty-Mites Skateboarding","Go-Joe learn how to use a skateboard and ride down some ramps with their instructor.",BBC,1303131413,http://p2pnextfeed1-staging.rad0.net/v2/content/info/bbc/bbctwo/b00tfqh4,urn:bbc-bbctwo-b00tfqh4,,,http://p2pnextfeed1-staging.rad0.net/v2/content/info/bbc/bbctwo/b00tfqh4,http://www.bbc.co.uk/iplayer/images/series/b00t9k4z_150_84.jpg,"Go-Joe learn how to use a skateboard and ride down some ramps with their instructor.",,BBC,BBC,"Copyright 2011 BBC",PT0H15M0S,"BBC Two England"
"Green Balloon Club Goes on Holiday Series 2, Episode 1","It's Jelly's first time in a sailing boat when she goes exploring on Strangford Lough.",BBC,1303131413,http://p2pnextfeed1-staging.rad0.net/v2/content/info/bbc/bbctwo/b00phb9t,urn:bbc-bbctwo-b00phb9t,,,http://p2pnextfeed1-staging.rad0.net/v2/content/info/bbc/bbctwo/b00phb9t,http://www.bbc.co.uk/iplayer/images/series/b00pj38z_150_84.jpg,"It's Jelly's first time in a sailing boat when she goes exploring on Strangford Lough.",,BBC,BBC,"Copyright 2011 BBC",PT0H25M0S,"BBC Two England"
"Waybuloo Series 1, Whistle","After seeing Lau Lau whistle, Nok Tok tries to learn how, but finds it hard work.",BBC,1303131413,http://p2pnextfeed1-staging.rad0.net/v2/content/info/bbc/bbctwo/b00kwrcj,urn:bbc-bbctwo-b00kwrcj,,,http://p2pnextfeed1-staging.rad0.net/v2/content/info/bbc/bbctwo/b00kwrcj,http://www.bbc.co.uk/iplayer/images/series/b00kmj8q_150_84.jpg,"After seeing Lau Lau whistle, Nok Tok tries to learn how, but finds it hard work.",,BBC,BBC,"Copyright 2011 BBC",PT0H20M0S,"BBC Two England"
"In the Night Garden Series 1, The Pontipines' Picnic","The Pontipines look for the perfect place to have a picnic. They invite the Wottingers.",BBC,1303131413,http://p2pnextfeed1-staging.rad0.net/v2/content/info/bbc/bbctwo/b00dd02k,urn:bbc-bbctwo-b00dd02k,,,http://p2pnextfeed1-staging.rad0.net/v2/content/info/bbc/bbctwo/b00dd02k,http://www.bbc.co.uk/iplayer/images/series/b0073h0z_150_84.jpg,"The Pontipines look for the perfect place to have a picnic. They invite the Wottingers.",,BBC,BBC,"Copyright 2011 BBC",PT0H30M0S,"BBC Two England"
"The Pink Panther Show","Pink Panther changes the designs for a house to his own pinkprints.",BBC,1303131413,http://p2pnextfeed1-staging.rad0.net/v2/content/info/bbc/bbctwo/b010px5f,urn:bbc-bbctwo-b010px5f,,,http://p2pnextfeed1-staging.rad0.net/v2/content/info/bbc/bbctwo/b010px5f,http://www.bbc.co.uk/iplayer/images/progbrand/b010r4dq_150_84.jpg,"Pink Panther changes the designs for a house to his own pinkprints.",,BBC,BBC,"Copyright 2011 BBC",PT0H25M0S,"BBC Two England"
"Animal Park Series 7: 30 minute reversions, Episode 6","With cubs on the way, there are dramatic developments in Wolf Wood.",BBC,1303131413,http://p2pnextfeed1-staging.rad0.net/v2/content/info/bbc/bbctwo/b007qpgv,urn:bbc-bbctwo-b007qpgv,,,http://p2pnextfeed1-staging.rad0.net/v2/content/info/bbc/bbctwo/b007qpgv,http://www.bbc.co.uk/iplayer/images/series/b00q7c68_150_84.jpg,"With cubs on the way, there are dramatic developments in Wolf Wood.",,BBC,BBC,"Copyright 2011 BBC",PT0H30M0S,"BBC Two England"
"World Championship Snooker 2011, Day 3, Part 1","China's Ding Junhui and Scotland's Jamie Burnett play to a finish.",BBC,1303131413,http://p2pnextfeed1-staging.rad0.net/v2/content/info/bbc/bbctwo/b010pzvb,urn:bbc-bbctwo-b010pzvb,,,http://p2pnextfeed1-staging.rad0.net/v2/content/info/bbc/bbctwo/b010pzvb,http://www.bbc.co.uk/iplayer/images/series/b010q8d8_150_84.jpg,"China's Ding Junhui and Scotland's Jamie Burnett play to a finish.",,BBC,BBC,"Copyright 2011 BBC",PT4H40M0S,"BBC Two England"
"Put Your Money Where Your Mouth Is Series 3, Katherine Higgins v John Cameron: Auction","Katherine Higgins and John Cameron find out who bags the best lots at an antiques auction.",BBC,1303131413,http://p2pnextfeed1-staging.rad0.net/v2/content/info/bbc/bbctwo/b00sj5z1,urn:bbc-bbctwo-b00sj5z1,,,http://p2pnextfeed1-staging.rad0.net/v2/content/info/bbc/bbctwo/b00sj5z1,http://www.bbc.co.uk/iplayer/images/series/b00sgbyy_150_84.jpg,"Katherine Higgins and John Cameron find out who bags the best lots at an antiques auction.",,BBC,BBC,"Copyright 2011 BBC",PT0H45M0S,"BBC Two England"
"Party Election Broadcasts English Local Elections 2011, The Labour Party: 18/04/2011","Party election broadcast by the Labour Party for the May 5 English local elections.",BBC,1303131413,http://p2pnextfeed1-staging.rad0.net/v2/content/info/bbc/bbctwo/b010nlv8,urn:bbc-bbctwo-b010nlv8,,,http://p2pnextfeed1-staging.rad0.net/v2/content/info/bbc/bbctwo/b010nlv8,http://www.bbc.co.uk/iplayer/images/series/b010jssd_150_84.jpg,"Party election broadcast by the Labour Party for the May 5 English local elections.",,BBC,BBC,"Copyright 2011 BBC",PT0H5M0S,"BBC Two England"
"Eggheads Series 12, Episode 8","Dermot Murnaghan hosts a general knowledge quiz featuring the UK's top quiz champions.",BBC,1303131413,http://p2pnextfeed1-staging.rad0.net/v2/content/info/bbc/bbctwo/b010ntpg,urn:bbc-bbctwo-b010ntpg,,,http://p2pnextfeed1-staging.rad0.net/v2/content/info/bbc/bbctwo/b010ntpg,http://www.bbc.co.uk/iplayer/images/series/b01091rq_150_84.jpg,"Dermot Murnaghan hosts a general knowledge quiz featuring the UK's top quiz champions.",,BBC,BBC,"Copyright 2011 BBC",PT0H30M0S,"BBC Two England"
"Great British Menu Series 6, North West Starter","Chefs from the North West prepare their starters to be judged by Marcus Wareing.",BBC,1303131413,http://p2pnextfeed1-staging.rad0.net/v2/content/info/bbc/bbctwo/b010p03t,urn:bbc-bbctwo-b010p03t,,,http://p2pnextfeed1-staging.rad0.net/v2/content/info/bbc/bbctwo/b010p03t,http://www.bbc.co.uk/iplayer/images/series/b0109glr_150_84.jpg,"Chefs from the North West prepare their starters to be judged by Marcus Wareing.",,BBC,BBC,"Copyright 2011 BBC",PT0H30M0S,"BBC Two England"
"World Championship Snooker 2011, Day 3, Part 2","Peter Ebdon begins his 20th World Championship campaign against Stuart Bingham.",BBC,1303131413,http://p2pnextfeed1-staging.rad0.net/v2/content/info/bbc/bbctwo/b010pzvd,urn:bbc-bbctwo-b010pzvd,,,http://p2pnextfeed1-staging.rad0.net/v2/content/info/bbc/bbctwo/b010pzvd,http://www.bbc.co.uk/iplayer/images/series/b010q8d8_150_84.jpg,"Peter Ebdon begins his 20th World Championship campaign against Stuart Bingham.",,BBC,BBC,"Copyright 2011 BBC",PT1H0M0S,"BBC Two England"
"Railway Walks Discovering Snowdonia","Julia Bradbury takes a walk along the stunning Mawddach estuary in north Wales.",BBC,1303131413,http://p2pnextfeed1-staging.rad0.net/v2/content/info/bbc/bbctwo/b00dwflf,urn:bbc-bbctwo-b00dwflf,,,http://p2pnextfeed1-staging.rad0.net/v2/content/info/bbc/bbctwo/b00dwflf,http://www.bbc.co.uk/iplayer/images/series/b00dtp33_150_84.jpg,"Julia Bradbury takes a walk along the stunning Mawddach estuary in north Wales.",,BBC,BBC,"Copyright 2011 BBC",PT0H30M0S,"BBC Two England"
"Raymond Blanc's Kitchen Secrets Series 2, Summer Greens","Chef Raymond Blanc celebrates the freshest summer greens.",BBC,1303131413,http://p2pnextfeed1-staging.rad0.net/v2/content/info/bbc/bbctwo/b010dq7v,urn:bbc-bbctwo-b010dq7v,,,http://p2pnextfeed1-staging.rad0.net/v2/content/info/bbc/bbctwo/b010dq7v,http://www.bbc.co.uk/iplayer/images/series/b00yk22g_150_84.jpg,"Chef Raymond Blanc celebrates the freshest summer greens.",,BBC,BBC,"Copyright 2011 BBC",PT0H30M0S,"BBC Two England"
"Fix My Family","Homeless parents receive support to avoid having their children taken into care.",BBC,1303131413,http://p2pnextfeed1-staging.rad0.net/v2/content/info/bbc/bbctwo/b010n37l,urn:bbc-bbctwo-b010n37l,,,http://p2pnextfeed1-staging.rad0.net/v2/content/info/bbc/bbctwo/b010n37l,http://www.bbc.co.uk/iplayer/images/episode/b010n37l_150_84.jpg,"Homeless parents receive support to avoid having their children taken into care.",,BBC,BBC,"Copyright 2011 BBC",PT1H0M0S,"BBC Two England"
"Never Mind the Buzzcocks Series 23, Episode 8","Guests include host Martin Freeman and panellists Martha Wainwright and Charlie Brooker.",BBC,1303131413,http://p2pnextfeed1-staging.rad0.net/v2/content/info/bbc/bbctwo/b00p1m6t,urn:bbc-bbctwo-b00p1m6t,,,http://p2pnextfeed1-staging.rad0.net/v2/content/info/bbc/bbctwo/b00p1m6t,http://www.bbc.co.uk/iplayer/images/series/b00n4vwh_150_84.jpg,"Guests include host Martin Freeman and panellists Martha Wainwright and Charlie Brooker.",,BBC,BBC,"Copyright 2011 BBC",PT0H30M0S,"BBC Two England"
Newsnight,"Analysis of the stories behind the day's headlines with Jeremy Paxman.",BBC,1303131413,http://p2pnextfeed1-staging.rad0.net/v2/content/info/bbc/bbctwo/b010m05f,urn:bbc-bbctwo-b010m05f,,,http://p2pnextfeed1-staging.rad0.net/v2/content/info/bbc/bbctwo/b010m05f,http://www.bbc.co.uk/iplayer/images/progbrand/b006mk25_150_84.jpg,"Analysis of the stories behind the day's headlines with Jeremy Paxman.",,BBC,BBC,"Copyright 2011 BBC",PT0H50M0S,"BBC Two England"
"An Island Parish Series 5, A Question of Survival","It is the end of Father John Paul's first year as the new Catholic priest on Barra.",BBC,1303131413,http://p2pnextfeed1-staging.rad0.net/v2/content/info/bbc/bbctwo/b010gbq5,urn:bbc-bbctwo-b010gbq5,,,http://p2pnextfeed1-staging.rad0.net/v2/content/info/bbc/bbctwo/b010gbq5,http://www.bbc.co.uk/iplayer/images/series/b00y1xb8_150_84.jpg,"It is the end of Father John Paul's first year as the new Catholic priest on Barra.",,BBC,BBC,"Copyright 2011 BBC",PT0H30M0S,"BBC Two England"
"World Championship Snooker Highlights 2011, Day 3","First round action from former world champions Stephen Hendry and Ronnie O'Sullivan.",BBC,1303131413,http://p2pnextfeed1-staging.rad0.net/v2/content/info/bbc/bbctwo/b010pzxj,urn:bbc-bbctwo-b010pzxj,,,http://p2pnextfeed1-staging.rad0.net/v2/content/info/bbc/bbctwo/b010pzxj,http://www.bbc.co.uk/iplayer/images/series/b010q8qd_150_84.jpg,"First round action from former world champions Stephen Hendry and Ronnie O'Sullivan.",,BBC,BBC,"Copyright 2011 BBC",PT0H50M0S,"BBC Two England"
"World Championship Snooker Extra 2011, Day 3","Further highlights of the first round in Sheffield.",BBC,1303131413,http://p2pnextfeed1-staging.rad0.net/v2/content/info/bbc/bbctwo/b010pzxl,urn:bbc-bbctwo-b010pzxl,,,http://p2pnextfeed1-staging.rad0.net/v2/content/info/bbc/bbctwo/b010pzxl,http://www.bbc.co.uk/iplayer/images/series/b010q8qq_150_84.jpg,"Further highlights of the first round in Sheffield.",,BBC,BBC,"Copyright 2011 BBC",PT2H0M0S,"BBC Two England"
"Joins BBC News","BBC Two joins the BBC's rolling news channel.",BBC,1303131413,http://p2pnextfeed1-staging.rad0.net/v2/content/info/bbc/bbctwo/b010f28m,urn:bbc-bbctwo-b010f28m,,,http://p2pnextfeed1-staging.rad0.net/v2/content/info/bbc/bbctwo/b010f28m,http://www.bbc.co.uk/iplayer/images/progbrand/b00h9fxh_150_84.jpg,"BBC Two joins the BBC's rolling news channel.",,BBC,BBC,"Copyright 2011 BBC",PT0H35M0S,"BBC Two England"
"Super League Show 2011, Episode 10","Harry Gration presents the best of the action from round ten of the Engage Super League.",BBC,1303131413,http://p2pnextfeed1-staging.rad0.net/v2/content/info/bbc/bbctwo/b010hcjs,urn:bbc-bbctwo-b010hcjs,,,http://p2pnextfeed1-staging.rad0.net/v2/content/info/bbc/bbctwo/b010hcjs,http://www.bbc.co.uk/iplayer/images/series/b00yqhgd_150_84.jpg,"Harry Gration presents the best of the action from round ten of the Engage Super League.",,BBC,BBC,"Copyright 2011 BBC",PT0H45M0S,"BBC Two England"
"GCSE Bitesize Revision Science 1 - Physics","Covering electricity, forces and motion, waves, energy resources and energy transfer.",BBC,1303131413,http://p2pnextfeed1-staging.rad0.net/v2/content/info/bbc/bbctwo/b0077fl8,urn:bbc-bbctwo-b0077fl8,,,http://p2pnextfeed1-staging.rad0.net/v2/content/info/bbc/bbctwo/b0077fl8,http://www.bbc.co.uk/iplayer/images/progbrand/b0080k0c_150_84.jpg,"Covering electricity, forces and motion, waves, energy resources and energy transfer.",,BBC,BBC,"Copyright 2011 BBC",PT2H0M0S,"BBC Two England"
